{
  "case_id": "EXP12-P-001",
  "registration_ref": "evidence/exp-12/prospective/P-001_PRE_REGISTRATION.json",
  "registration_sha256": "70d5a2ef1ca8395a2e3496300b349fbbe418aeb8c734238d60cf2af8d8a5fadb",
  "engine_ref": "scripts/triage_engine.py",
  "engine_sha256": "815566cc9cce865aee286d9a6c2e0235b127fe89a578f0ea380e8c438f1c181c",
  "engine_output": {
    "task_id": "EXP12-P-001",
    "execution_confidence": 85,
    "complexity": 2,
    "risk": 2,
    "blast_radius": 0,
    "affected_repositories": ["murat-project-engineer"],
    "architectural_impact": 1,
    "data_sensitivity": 0,
    "unknowns": 1,
    "deep_change_probability": 17,
    "human_approval_required": false,
    "human_approval_reasons": [],
    "recommended_risk_tier": "VERIFIED",
    "engine_version": "0.1.0"
  },
  "state": "EXECUTED"
}
